{
  "eventId": "c2c73b35-7801-4b95-a88b-bdcd882a24a6",
  "eventType": "InventoryReserved",
  "schemaVersion": 1,
  "occurredAt": "2026-09-20T12:34:56Z",
  "orderId": "07e71c02-8c9e-4571-b16f-c7020e19f68c",
  "correlationId": "phase4-proof",
  "causationId": "ddf7e6e4-706f-4bc8-a54c-93271b8aee63",
  "lines": [
    {
      "sku": "SKU-B",
      "quantity": 2
    },
    {
      "sku": "SKU-A",
      "quantity": 1
    }
  ]
}
